{
  "$schema": "./tool-policy.schema.json",
  "defaults": {
    "read": "allow",
    "create": "allow",
    "edit": "deny",
    "destroy": "deny"
  },
  "domains": {},
  "tools": {
    "teamdynamix_get_current_user": "inherit",
    "teamdynamix_search_tickets": "inherit",
    "teamdynamix_get_ticket": "inherit",
    "teamdynamix_create_ticket": "inherit",
    "teamdynamix_edit_ticket": "inherit",
    "teamdynamix_get_ticket_feed": "inherit",
    "teamdynamix_add_ticket_comment": "inherit",
    "teamdynamix_get_ticket_tasks": "inherit",
    "teamdynamix_create_ticket_task": "inherit",
    "teamdynamix_edit_ticket_task": "inherit",
    "teamdynamix_search_assets": "inherit",
    "teamdynamix_get_asset": "inherit",
    "teamdynamix_create_asset": "inherit",
    "teamdynamix_edit_asset": "inherit",
    "teamdynamix_get_asset_feed": "inherit",
    "teamdynamix_add_asset_comment": "inherit",
    "teamdynamix_search_cis": "inherit",
    "teamdynamix_get_ci": "inherit",
    "teamdynamix_create_ci": "inherit",
    "teamdynamix_edit_ci": "inherit",
    "teamdynamix_get_ci_feed": "inherit",
    "teamdynamix_add_ci_comment": "inherit",
    "teamdynamix_get_ci_relationships": "inherit",
    "teamdynamix_add_ci_relationship": "inherit",
    "teamdynamix_remove_ci_relationship": "inherit",
    "teamdynamix_link_ci_to_ticket": "inherit",
    "teamdynamix_search_projects": "inherit",
    "teamdynamix_get_project": "inherit",
    "teamdynamix_create_project": "inherit",
    "teamdynamix_edit_project": "inherit",
    "teamdynamix_get_project_feed": "inherit",
    "teamdynamix_add_project_comment": "inherit",
    "teamdynamix_search_issues": "inherit",
    "teamdynamix_get_issue": "inherit",
    "teamdynamix_create_issue": "inherit",
    "teamdynamix_edit_issue": "inherit",
    "teamdynamix_lookup_people": "inherit",
    "teamdynamix_search_people": "inherit",
    "teamdynamix_get_person": "inherit",
    "teamdynamix_get_person_uid": "inherit",
    "teamdynamix_search_groups": "inherit",
    "teamdynamix_get_group": "inherit",
    "teamdynamix_get_group_members": "inherit",
    "teamdynamix_add_group_members": "inherit",
    "teamdynamix_remove_group_members": "inherit",
    "teamdynamix_list_applications": "inherit",
    "teamdynamix_list_ticket_types": "inherit",
    "teamdynamix_list_ticket_statuses": "inherit",
    "teamdynamix_list_ticket_priorities": "inherit",
    "teamdynamix_list_ticket_sources": "inherit",
    "teamdynamix_list_ticket_forms": "inherit",
    "teamdynamix_list_ticket_impacts": "inherit",
    "teamdynamix_list_ticket_urgencies": "inherit",
    "teamdynamix_list_asset_statuses": "inherit",
    "teamdynamix_list_product_models": "inherit",
    "teamdynamix_list_ci_types": "inherit",
    "teamdynamix_list_ci_relationship_types": "inherit",
    "teamdynamix_list_accounts": "inherit",
    "teamdynamix_list_locations": "inherit",
    "teamdynamix_list_custom_attributes": "inherit",
    "teamdynamix_list_reports": "inherit",
    "teamdynamix_get_report": "inherit",
    "teamdynamix_list_saved_searches": "inherit",
    "teamdynamix_run_saved_search": "inherit"
  },
  "treatReadModifyWriteAsDestroy": false
}
